key,jp,en,ru
phrase1,平民の出のマリアが,,
phrase2,魔法学園の生徒会メンバーに任命されたのは、,,
phrase3,彼女の成績が優秀であるがゆえである。,,
phrase4,（今日から私も生徒会の一員……,,
phrase5,しっかり頑張らないとっ……！）,,
phrase6,緊張と使命感を胸に,,
phrase7,マリアは生徒会室への扉を開けた。,,
phrase8,――こんにちは。,,
phrase9,君が新メンバーのキャンベル嬢ですね？,,
phrase10,マリアを出迎えたのは,,
phrase11,生徒会副会長にして宰相である,,
phrase12,アスカルト伯爵の子息ニコル・アスカルトだった。,,
phrase13,上級生で、マリアにとって一歳年上の先輩である。,,
phrase14,ごきげんよう。,,
phrase15,マリア・キャンベルです。どうぞよろしくお願いします。,,
phrase16,マリアは深々とお辞儀をする。,,
phrase17,……と、ニコルとは異なる視線を感じて,,
phrase18,顔を上げれば、彼の背に隠れて,,
phrase19,白い少女がマリアを見つめていた。,,
phrase20,（綺麗な人……！）,,
phrase21,っ！,,
phrase22,少女と目が合った瞬間、,,
phrase23,彼女はニコルの後ろに完全に隠れてしまった。,,
phrase24,ニコル・アスカルトだ。と名乗り、ニコルが苦笑する。,,
phrase25,こちらは妹のソフィアです。,,
phrase26,……少し人見知りで。どうかお気になさらず。,,
phrase27,妹さんなのですね。,,
phrase28,ソフィア様、どうぞよろしくお願いいたします。,,
phrase29,マリアは彼女へも挨拶をするが,,
phrase30,ソフィアはニコルの後ろから,,
phrase31,出てきてはくれなかった……。,,
phrase32,ソフィア様、生徒会の皆さんに,,
phrase33,マフィンを作ってきたんです。いかがですか？,,
phrase34,……甘いもの、好きではないので。,,
phrase35,あ、あの……ソフィア様,,
phrase36,焼き菓子があるのですが……,,
phrase37,お砂糖は控えめに作ったので、よろしければどうぞ。,,
phrase38,……虫歯になったら、嫌なので。,,
phrase39,ソフィア様、庭園で綺麗な薔薇が咲いておりました。,,
phrase40,一緒に見にいきませんか？,,
phrase41,……日差しが、得意ではないので。,,
phrase42,日傘なら、私が持ちます。,,
phrase43,…………じゃあ、ちょっとだけ。,,
phrase44,マリアとソフィアが,,
phrase45,庭園を歩いている姿を,,
phrase46,ニコルは生徒会室の窓から眺めていた。,,
phrase47,（不思議な人、だ……）,,
phrase48,日傘を持って、ソフィアへ,,
phrase49,微笑みかけているマリアにニコルは目を細めた。,,
phrase50,ニコルの見た目や立場に惑わされて,,
phrase51,すり寄ってくることもなく。,,
phrase52,周囲とは異なった容姿のソフィアにも,,
phrase53,あんなにも明るく接して。,,
phrase54,ニコルは最近、ソフィアの変化を感じ取っていた。,,
phrase55,マリアがソフィアに、アプローチを始めてからだ。,,
phrase56,どうも、ソフィアはマリアに対し最初は,,
phrase57,「兄に近寄るため、自分に近づいた」,,
phrase58,と思っていたようだ。,,
phrase59,兄を取られたくない。,,
phrase60,兄に嫌な女を近づけさせたくない。,,
phrase61,ゆえにマリアへ素っ気ない態度をとっていた,,
phrase62,ソフィアであるが、それでもめげずに,,
phrase63,笑顔を向けるマリアへ少しずつ心を開き始めている。,,
phrase64,（ソフィアが、笑みを……）,,
phrase65,マリアに対し、小さくではあるが,,
phrase66,ソフィアは笑顔を浮かべていた。,,
phrase67,妹のあんな顔を見たのはいつ以来か……。,,
phrase68,本当に……不思議な人だ、あなたは。,,
phrase69,生徒会室へ向かう途中、マリアはニコルと鉢合わせた。,,
phrase70,こんにちは、ニコル様,,
phrase71,こんにちは、キャンベル嬢。,,
phrase72,……行先は同じですから一緒に行きましょうか。,,
phrase73,あ、はいっ！,,
phrase74,魔法学園の敷地は広い。,,
phrase75,長い廊下を二人は歩く。,,
phrase76,先日もソフィアの相手をしていただいたようで。,,
phrase77,いえいえ。,,
phrase78,ソフィア様とお友達になれて私も嬉しいです！,,
phrase79,……そうですか。,,
phrase80,（ニコル様、よっぽど,,
phrase81,ソフィア様のことが大切なんだろうなぁ……）,,
phrase82,マリアは微笑ましい気持ちになった。,,
phrase83,……そんな時だった。,,
phrase84,ひそひそ、と物陰から噂話が聞こえてくる。,,
phrase85,ニコル様は素晴らしい方なのに、あのような見た目の,,
phrase86,妹さんがいらっしゃって、お可哀そうだわ。,,
phrase87,きっと疎んでいらっしゃるはずよ。,,
phrase88,もしかして、ソフィア嬢は,,
phrase89,宰相閣下の愛人の子だったりして……。,,
phrase90,ソフィア嬢の顔『は』,,
phrase91,良くていらっしゃるから案外そうかもしれなくてよ？,,
phrase92,ふふふっ。,,
phrase93,あははははははっ――,,
phrase94,……。,,
phrase95,ニコルは少し眉根を寄せるが,,
phrase96,何かを言うことはなかった。,,
phrase97,マリアはそっとニコルの顔を,,
phrase98,窺い見ると、一度大きく息を吸って――,,
phrase99,ニコル様には、あんなに素敵な妹さんが,,
phrase100,いらっしゃるから、きっと,,
phrase101,ヤキモチを焼かれているのですね。,,
phrase102,……！,,
phrase103,ニコルは思わず立ち止まってマリアを見つめた。,,
phrase104,その真剣な眼差しに、まずいことを,,
phrase105,言ってしまっただろうかと不安になる。,,
phrase106,マリアは謝罪を口にしようとしたが,,
phrase107,それよりも先にニコルが口を開いた。,,
phrase108,……妹のことを、そのように,,
phrase109,言われたのは初めてですよ。,,
phrase110,ありがとうございます、キャンベル嬢。,,
phrase111,ふわり。,,
phrase112,花のような笑みを浮かべるニコル。,,
phrase113,その言葉は、普段は感情を見せないニコルが,,
phrase114,見せてくれた真っ直ぐな想いなのだとマリアは感じた。,,
phrase115,私は、ソフィア様のような妹さんがいるニコル様を,,
phrase116,とてもうらやましく思います。,,
phrase117,ニコル様が、ソフィア様をとても大切に,,
phrase118,していらっしゃるということも伝わってきます。,,
phrase119,だから私は、私自身が感じた,,
phrase120,ニコル様とソフィア様を心から信じています。,,
phrase121,……。,,
phrase122,ニコルは思わず立ち止まってマリアを見つめた。,,
phrase123,マリアは真っ直ぐに、ニコルの瞳を見つめ返す。,,
phrase124,自分の言葉、そして心に,,
phrase125,一切の偽りがないことを示すかのように。,,
phrase126,心から信じる、ですか。,,
phrase127,苦笑のように、でも綻ぶように,,
phrase128,ニコルは小さく笑ってみせた。,,
phrase129,……その言葉をこちらも信じましょう、『心から』,,
phrase130,ありがとうございます、キャンベル嬢。,,
phrase131,その言葉は、普段は感情を,,
phrase132,見せないニコルが見せてくれた,,
phrase133,安堵と感謝の優しい想いだった。,,
phrase134,お礼なんて……。,,
phrase135,私は、思ったことをそのまま口にしただけですから。,,
phrase136,謙遜しながらも,,
phrase137,ニコルが見せてくれた心からの笑みに,,
phrase138,マリアの心臓はドキドキと高鳴っていた。,,
phrase139,マリアは重い溜息を吐いた。,,
phrase140,もうすぐ魔法学園の卒業式。,,
phrase141,ニコルが卒業する日が、迫っていた。,,
phrase142,永遠のお別れじゃないけれど……。,,
phrase143,ニコル様は貴族で、私は平民。,,
phrase144,卒業したら、もうお会いすることも,,
phrase145,なくなるかもしれない。,,
phrase146,生徒会室で雑務をこなしながら,,
phrase147,小さく独り言をこぼすと。,,
phrase148,どうかしましたか？,,
phrase149,いつのまにか、傍にニコルがいた。,,
phrase150,マリアは弾かれたように顔を上げる。,,
phrase151,あっ、いえ、なんでもないです！,,
phrase152,誤魔化さないで。,,
phrase153,どうやらニコルの方が一枚上手なようだ。,,
phrase154,じっと彼に見つめられて,,
phrase155,マリアは自分の手元に視線を落とした。,,
phrase156,もうすぐ卒業式なので……。,,
phrase157,ニコル様が卒業されてしまうと思うと,,
phrase158,寂しいな、と感じてしまって……。,,
phrase159,……いけませんよね！,,
phrase160,おめでたいことなのに,,
phrase161,こんな、しんみりしちゃうなんて……。,,
phrase162,誤魔化さないでと言われたのに,,
phrase163,結局、マリアは強がるように,,
phrase164,笑みを浮かべてしまった。,,
phrase165,よかった。,,
phrase166,ニコルがくすりと笑う。,,
phrase167,……俺も同じ気持ちだったから。,,
phrase168,え――。,,
phrase169,ニコルは目を細めて微笑んだまま,,
phrase170,テーブルの上のマリアの手に,,
phrase171,そっと自分の手を重ねた。,,
phrase172,今までは、出会いも別れも興味なんてなかったのに。,,
phrase173,……キャンベル嬢と過ごす時間が減ってしまうのは、,,
phrase174,すごく寂しい。心からそう思う。,,
phrase175,……ここまで家族以外の他人に,,
phrase176,興味を持ったのは、初めてだ。,,
phrase177,ニコル様……。,,
phrase178,……ずっと、俺の中で――,,
phrase179,何も知らない他人から,,
phrase180,愛する家族をー妹のソフィアを,,
phrase181,俺の重荷だと、そう言われ続けることが、苦しかった。,,
phrase182,見た目と肩書だけで判断して,,
phrase183,中身を見ようともしない者たちが,,
phrase184,媚びてすり寄ってくるのがほとほと嫌だった。,,
phrase185,……あなたは、俺とソフィアの,,
phrase186,中身を見て、笑みを向けてくれる。,,
phrase187,ソフィアがあんな風に笑顔を,,
phrase188,浮かべるようになったのは全てあなたのおかげだ。,,
phrase189,ありがとう、キャンベル嬢。,,
phrase190,あなたに心からの感謝を。,,
phrase191,そんな――こちらこそです、ニコル様。,,
phrase192,ニコル様もソフィア様も,,
phrase193,平民の私じゃなくて私自身を見てくださった。,,
phrase194,こんなに楽しく学園生活を送れたのは,,
phrase195,ニコル様たちのおかげです！,,
phrase196,ふふ、本当に？,,
phrase197,あうう……。,,
phrase198,ほ、本当ですよ！,,
phrase199,うん、わかっている。,,
phrase200,……ああ。,,
phrase201,久しく、心から笑うなんてことも忘れてたな。,,
phrase202,強くあらねば、しっかりせねば、と,,
phrase203,俺は気を張り続けていたのかもしれない。,,
phrase204,こんな風に思える日がくるなんて……。,,
phrase205,そう言ってマリアを見つめるニコルの眼差しは、,,
phrase206,温かくて眩しい日だまりを見るかのようであった。,,
phrase207,いいえ、そんな,,
phrase208,お礼を言われるようなことなんて……。,,
phrase209,マリアとしては、ありのままに,,
phrase210,ニコルとソフィアへ接していただけ。,,
phrase211,だからこそ、ニコルからの,,
phrase212,素直な感謝が気恥ずかしいのだ。,,
phrase213,……ふふ。君は照れ屋だね。,,
phrase214,でも、感謝ぐらいは素直に受け取ってほしいな。,,
phrase215,ご、ごめんなさい……。,,
phrase216,謝らなくていい。,,
phrase217,あうう……。,,
phrase218,あはは――君はかわいいね。,,
phrase219,……ああ。,,
phrase220,誰かにこんな想いを向けるなんて。,,
phrase221,誰かに、こんなに心を許すなんて。,,
phrase222,……思っても、みなかったな……。,,
phrase223,そう言ってマリアを見つめるニコルの眼差しは,,
phrase224,どこまでも優しくて、,,
phrase225,まるで春の日だまりのようであった。,,
phrase226,キャンベル嬢。,,
phrase227,明日の卒業パーティーで伝えたいことがある。,,
phrase228,どうか、パーティーに出席してほしい。,,
phrase229,ニコルはそう耳打ちして,,
phrase230,「では」と一礼しきびすを返すのであった。,,
phrase231,卒業パーティーは学園内でも,,
phrase232,その華やかさで知られている。,,
phrase233,――だからこそ、マリアは悩んでいた。,,
phrase234,平民の出であるマリアには,,
phrase235,中古の安いドレスを手直しして,,
phrase236,準備するのが精一杯。,,
phrase237,はたしてそんなドレスで,,
phrase238,ニコルの前に現れてもよいものか……。,,
phrase239,（私だけじゃなくて、一緒にいるだけで,,
phrase240,ニコル様まで笑われてしまうかも……）,,
phrase241,夜の女子寮で自室の鏡の前に立ち、,,
phrase242,マリアは溜息を吐いた。,,
phrase243,と、その時。,,
phrase244,部屋のドアがノックされる。,,
phrase245,はい？,,
phrase246,こんな時間に誰だろう、と,,
phrase247,マリアはドアを開けた。,,
phrase248,こんばんは、マリアさん。,,
phrase249,ソフィア様!?　どうしてこちらへ？,,
phrase250,マリアさんにお話ししたいことがあるのです。,,
phrase251,よろしいですか？,,
phrase252,ええ……どうぞ。,,
phrase253,マリアはソフィアを招き入れた。,,
phrase254,話を切り出したのはソフィアだ。,,
phrase255,真剣な目で、マリアを見つめる。,,
phrase256,お兄様のことを、どうお思いですか？,,
phrase257,え――。,,
phrase258,いきなりの言葉に面食らうが,,
phrase259,マリアは眉尻を下げ、本心を吐露した。,,
phrase260,……お別れしたくない、です。,,
phrase261,ニコル様が遠くに行ってしまうと,,
phrase262,考えると、心がギュッとして……切ないです。,,
phrase263,……できることなら,,
phrase264,ずっと、ニコル様のお傍にいたい……。,,
phrase265,その気持ちは本当ですか？,,
phrase266,思わず食い気味に答えてしまった。,,
phrase267,そんなマリアにソフィアはニコリと微笑む。,,
phrase268,そうおっしゃってくださると信じておりました。,,
phrase269,え……？,,
phrase270,だって、バレバレでしたもの。,,
phrase271,お兄様とマリアさんが慕い合っていることなんて。,,
phrase272,ソフィアはくすくすと笑った。,,
phrase273,マリアは顔が熱くなるのを感じた。,,
phrase274,……ふふ。,,
phrase275,もう少ししたら、マリアさんのことを,,
phrase276,『おねえさま』と呼ぶことになるのでしょうか。,,
phrase277,ソフィア様、何をおっしゃって……。,,
phrase278,あらあら。,,
phrase279,さて――そういうわけで。,,
phrase280,前祝となりますがマリアさんに贈り物がございます。,,
phrase281,後で、私の部屋にいらしてください。,,
phrase282,（……贈り物ってなんだろう？）,,
phrase283,緊張した面持ちで、,,
phrase284,マリアはソフィアの部屋の扉をノックした。,,
phrase285,すぐに中から返事がある。,,
phrase286,どうぞ、入ってください。,,
phrase287,これって……。,,
phrase288,――そこにあったのは,,
phrase289,控えめでありながらも麗しいドレス。,,
phrase290,平民のマリアが悪目立ちしないよう,,
phrase291,気遣いの行き届いた逸品であった。,,
phrase292,どうぞこちらを、マリアさん。,,
phrase293,……いいんですか？,,
phrase294,こんな、素敵な……！,,
phrase295,ええ、もちろんです！,,
phrase296,……どうか、お兄様をよろしくお願いします。,,
phrase297,あ、ありがとうございます！,,
phrase298,マリアのドレスは,,
phrase299,他の令嬢も惚れ惚れするような,,
phrase300,優雅で気品のあるものだった。,,
phrase301,いつもマリアをいじめる令嬢ですら,,
phrase302,その美しさには押し黙る他ない。,,
phrase303,しかし当のマリアはというと、このような,,
phrase304,華やかなドレスを着るなど生まれて初めてで、,,
phrase305,気恥ずかしさから壁の花となっていた。,,
phrase306,すると。,,
phrase307,そのドレス、よく似合っている。,,
phrase308,不意に傍で囁かれる甘い声。,,
phrase309,マリアが顔を上げると,,
phrase310,そこには華麗な礼装をまとったニコルが立っていた。,,
phrase311,とても綺麗だ。,,
phrase312,ニ、ニコル様こそ……っ。,,
phrase313,おや、それはどうも。,,
phrase314,ニコルは笑みを一つ浮かべると,,
phrase315,「さて」とマリアの手を取った。,,
phrase316,あちらで話をしようか。,,
phrase317,彼が手を引いて歩きだした先は,,
phrase318,満天の星空が広がる静かなバルコニーだった。,,
phrase319,パーティーの喧噪が遠くに聞こえる。,,
phrase320,――マリア。,,
phrase321,キャンベル嬢、ではなく,,
phrase322,ニコルが初めて、その名を口にした。,,
phrase323,マリアは驚きに包まれた。,,
phrase324,遠くの喧噪が聞こえなくなるほどに。,,
phrase325,そんなマリアを優しく見つめ,,
phrase326,ニコルは言葉を続けるのだ。,,
phrase327,君のことが好きだ。,,
phrase328,これからも、ずっとマリアと共に歩んでいきたい。,,
phrase329,君となら、優しく温かな日々を,,
phrase330,ずっと紡いでいける気がするんだ。,,
phrase331,君を手放したくない。こんな気持ち……初めてなんだ。,,
phrase332,だから……マリア。,,
phrase333,どうか俺の生涯のパートナーになってくれないか。,,
phrase334,そう言って、ニコルはかしずくと,,
phrase335,マリアへと手を差し出した。,,
phrase336,……！,,
phrase337,出会った頃のような敬語ではなく,,
phrase338,キャンベル嬢呼びでもない。,,
phrase339,それはニコルの本当の想いを込めた言葉。,,
phrase340,マリアは、こんなに大きくて,,
phrase341,そして温かな想いを向けられたのは,,
phrase342,生まれて初めてだった。,,
phrase343,衝撃に、さすがに,,
phrase344,狼狽の気持ちが込み上げるが――,,
phrase345,（私は、ニコル様とお別れしたくない。,,
phrase346,これからもずっと一緒にいたい）,,
phrase347,ソフィアへ語った自分の気持ちを,,
phrase348,――恋心を思い出す。,,
phrase349,マリアは凛とした眼差しをニコルに向ける。,,
phrase350,私は――,,
phrase351,ずっと、あなたに恋をしていました。,,
phrase352,……どうか私をあなたのお傍に置いてください。,,
phrase353,ずっと、ずっと……。,,
phrase354,マリアはニコルの手を取った。,,
phrase355,するとニコルは春花のように微笑んで,,
phrase356,彼女の手の甲に恭しくキスをした。,,
phrase357,あなたに永遠の愛を誓おう。,,
phrase358,マリアの手を握ってニコルが立ち上がる。,,
phrase359,よろしくお願いします、ニコル様――。,,
phrase360,マリアはその手を,,
phrase361,心からの想いを込めて握り返した。,,
phrase362,優しい風が吹いて、花弁が二人を,,
phrase363,祝福するかのように舞い踊る――,,
phrase364,本当に自分でいいのだろうか。,,
phrase365,この気持ちに、素直になってもいいのだろうか。,,
phrase366,そんな想いが、マリアの心に渦巻いた。,,
phrase367,だけど――,,
phrase368,大丈夫。,,
phrase369,ニコルが、マリアの手を取った。,,
phrase370,そのまま彼女の手の甲に恭しくキスをする。,,
phrase371,あなたに永遠の愛を誓おう。,,
phrase372,あなたを護り抜いてみせる。,,
phrase373,どうか――僕を信じて。,,
phrase374,立ち上がるニコルが、マリアの体を,,
phrase375,優しく抱きしめた。,,
phrase376,ようやっと、マリアは言葉を絞り出す。,,
phrase377,心からの、素直な言葉を。,,
phrase378,私も……,,
phrase379,愛しております、ニコル様……。,,
phrase380,満天の星空が二人を祝福するかのように,,
phrase381,きらきらと瞬いていた――。,,
